uuid,movie_name,movie_date,movie_rating,movie_genre,comment_user,comment_date,comment_text
b4e9f923-d230-4f67-a5c0-16d3fd46f317,Caça-Fantasmas: O Império do Gelo,2024,6.2,Adventure; Comedy; Fantasy,Delboy1066,22 March 2024,"""Ghostbusters: Frozen Empire"" masterfully navigates the delicate balance between catering to nostalgic fans and captivating a younger audience with its modern twists"
4fc26141-53af-4cc1-8e02-4d9a5c370559,Caça-Fantasmas: O Império do Gelo,2024,6.2,Adventure; Comedy; Fantasy,peterfbrand-89486,9 May 2024,"So much promise, too much stupidity, Perhaps the movie was trying to entertain the younger generation"
0ea2eeba-c6dc-40b3-bde1-183e43eee8cd,Amor em Sangue,2024,6.7,Action; Adventure; Crime,steveinadelaide,23 March 2024,"Rose Glass, the visionary director behind Saint Maud, throws another punch with Love Lies Bleeding, a neo-noir crime thriller that's both stylish and unsettling"
2e4f6ba5-d8d1-4fc9-8646-8da2e1d7bac2,Amor em Sangue,2024,6.7,Action; Adventure; Crime,aidanDpolonsky,15 March 2024,This isn't some jam down your throat gay movie
cb4f51f9-58cb-4ebd-a110-d24eb739b6a5,Amor em Sangue,2024,6.7,Action; Adventure; Crime,PotassiumMan,23 March 2024,"In the southwest in the late 1980s, a young female bodybuilder finds a new home in a small town"
149a77e9-7c50-4a4b-9100-1b68ec818a31,Amor em Sangue,2024,6.7,Action; Adventure; Crime,AfricanBro,16 March 2024,My first thought was it feels like the gym was depicted in the way someone who doesn't go to the gym imagines the gym is like
a415d57e-884c-4cff-9a3f-ccd02b1c1c54,Amor em Sangue,2024,6.7,Action; Adventure; Crime,spencermcook,21 January 2024,"""Love Lies Bleeding"" is endlessly thrilling, unapologetically gruesome, and potently lustful in its perception of love, or in this case, more so in the idea of attachment"
626fa20b-d497-4721-bd13-0bca83c2d62e,Amor em Sangue,2024,6.7,Action; Adventure; Crime,diegelj-63837,10 May 2024,Really loved how gritty and diabolical a world this delves into
eeaec623-82b1-43e9-810a-313f1b4b6725,Amor em Sangue,2024,6.7,Action; Adventure; Crime,bmcmullan-27253,23 January 2024,"Fantastic movie, great cast"
ad30ffea-8471-465e-a925-a789cc9d85d4,Amor em Sangue,2024,6.7,Action; Adventure; Crime,minifiecw,24 March 2024,A24 strikes again
03d1ed06-6ae0-41e9-a2cd-f5f9d915bf46,Amor em Sangue,2024,6.7,Action; Adventure; Crime,hayzinj,9 March 2024,"I was intrigued by the trailer for this film, especially due to the cast, the tone and the fact that it was an A24 film"
7f6c3c08-19ef-43f6-9f8b-da5c4bfd4692,Amor em Sangue,2024,6.7,Action; Adventure; Crime,Pjtaylor-96-138044,10 May 2024,"'Love Lies Bleeding (2024)' is a sweaty, grimy, bloody romantic crime thriller about a disillusioned woman who falls in love with a bodybuilding hitchhiker whose steroid-infused rage soon lands both of them in big trouble"
945e1ff6-5d5e-4fd1-baa4-3d7b745dc6c2,Amor em Sangue,2024,6.7,Action; Adventure; Crime,dweston-38669,6 May 2024,"Rose Glass's follow up to Saint Maud is a sweaty,twisty thriller that's reminded me of a mash up of Blood Simple, Bound, Thelma and Louise and Breaking Bad/ Better Call Saul in its depiction of blue collar working class individuals thrown into a nightmare of double dealings, revenge,sex,drugs (with the exception of Bound) all filmed under a sun bleached environment"
b6f49f67-9634-4731-b720-5124d6408163,Amor em Sangue,2024,6.7,Action; Adventure; Crime,ongoam,8 May 2024,"Love, Lies, Bleeding was a Mixture between James Ellory and Cormac McCarthy"
78724456-b7d8-49b5-b175-9ec9e5b65378,Amor em Sangue,2024,6.7,Action; Adventure; Crime,ferguson-6,13 March 2024,Greetings again from the darkness
69dcdab7-4c27-4145-a412-da8e447ffca1,Amor em Sangue,2024,6.7,Action; Adventure; Crime,codyfernfan,17 March 2024,"This movie has a great mix of gore, sex appeal, LGBT representation, some comedic/ironic/""badass"" elements and portrayal of government corruption"
ff594d2f-af25-4f8a-982d-e569d102c3d3,Amor em Sangue,2024,6.7,Action; Adventure; Crime,njrmbm,22 March 2024,"There were a couple of fantastical steroid induced fever dream moments I wish hadn't been there, as I felt they took me out of such a dark and serious thriller, but generally an entertaining movie"
914fec83-61a4-46c6-b71a-3ac68cebea03,Amor em Sangue,2024,6.7,Action; Adventure; Crime,apereztenessa-1,17 March 2024,"I went into Love Lies Bleeding expecting to watch just another thriller, maybe with a dash of feminism and lgbtq rights, for taste"
303be493-3885-4d3f-a23e-4f1e2fca6cf5,Amor em Sangue,2024,6.7,Action; Adventure; Crime,Xstal,27 April 2024,"Living in a place, during a time that's clearly dated, where misogyny is rife, difference barely tolerated, then Daisy walks right in, to your place of work a gym, and your future's redefined, as two worlds collide your mated"
828e6390-7df2-44ca-9b3f-0cae90fa6dd6,Amor em Sangue,2024,6.7,Action; Adventure; Crime,rehmankhilji,26 April 2024,"I anticipate this review might receive some criticism, as all I seem to be encountering are overwhelmingly positive appraisals for the movie"
d16cdbe4-a7f2-4d73-8d79-d5ef51114f7b,Amor em Sangue,2024,6.7,Action; Adventure; Crime,nowayseattle,20 March 2024,I went to this movie not knowing anything about it
ec5713d3-470c-4089-a352-ee053d3d541e,Amor em Sangue,2024,6.7,Action; Adventure; Crime,LikeallHungarians,15 March 2024,I almost rated this movie a 7
30ed60ac-dc3b-4a2d-9c2a-d664da8ebfbb,Amor em Sangue,2024,6.7,Action; Adventure; Crime,gsdpjmcdgw,9 May 2024,"Well, even though Kristen Stewart only has three facial expressions - wet Sunday afternoon, miserable, and toilet smile - this is surprisingly good movie - there, I've committed that comment to writing"
109d7c0d-93af-414c-81f0-05f3c9358268,Road House,2024,6.2,Action; Thriller,lojitsu,6 May 2024,"Here's The 4K Lowedown on ""Road House"" (R - 2024 - Prime)"
780e5b0f-85fa-49e2-9c99-c5f3c9f79f93,Road House,2024,6.2,Action; Thriller,milyrouge,19 May 2024,Remakes of old films are all too often disappointing since they just try to rehash what made the first film work
9927a50f-380c-4e67-9567-7bc34700dd3b,Road House,2024,6.2,Action; Thriller,johnnyhbtvs27,22 March 2024,One of the great things about the original Road House was seeing Dalton clean house and improve the bar bit by bit
c104fa0d-642e-480b-9f1c-4be9c68741d5,Road House,2024,6.2,Action; Thriller,westbayou,30 March 2024,Ok fact: remakes suck
e8daf5ba-7dfb-44d7-b2f6-d8fa7f2d6f28,Road House,2024,6.2,Action; Thriller,chukkacabra,10 May 2024,This Road House remake had its parallels to the original but put a totally different spin on it to create a completely fresh story
6675e18e-c5c2-4e82-8b18-cfd7803cc23d,Road House,2024,6.2,Action; Thriller,darapjohnson,27 March 2024,I don't understand the bad reviews for this
2ede00dc-7c42-49a4-be21-744d93b5a5d8,Road House,2024,6.2,Action; Thriller,invisiblephrend,6 April 2024,Apparently the reviews are getting swarmed by boomers that didn't get their cream of wheat this morning
90f84d4c-d082-4526-be22-fe6c215ae868,Road House,2024,6.2,Action; Thriller,SaidNDone,22 March 2024,"""Road House"" feels like the highest budget 'made for TV' movie ever"
13354667-0f2d-4755-8a8a-fbc74d96148f,Road House,2024,6.2,Action; Thriller,nrshorter,21 March 2024,"I was expecting a fun action movie, and it started well"
18d796d1-fe1d-4ba7-a4b2-c44812590d2f,Road House,2024,6.2,Action; Thriller,jeltehelmholt,5 May 2024,"I have not seen the original road house, but really liked this version of it"
763d5561-2e7e-4a09-a7a1-df62498cf459,Road House,2024,6.2,Action; Thriller,NateWatchesCoolMovies,2 April 2024,So
6fd624f2-1f28-4e5b-99c3-894863368f75,Road House,2024,6.2,Action; Thriller,NicoleM1,22 March 2024,Casting felt very forced which pulls you out of the story
391843a8-f98c-475f-a331-d3e809354266,Road House,2024,6.2,Action; Thriller,masonsaul,22 March 2024,Road House is exactly what it needs to be
ad5f640e-c627-493d-b2c2-256652e74fde,Road House,2024,6.2,Action; Thriller,erelhukerek,25 May 2024,"The film has a different structure compared to the first version, it has some similarities, but it is not completely the same"
a4d95a83-8ca3-42ca-8f61-dad615d4ecb7,Road House,2024,6.2,Action; Thriller,olisilumea,14 April 2024,Road House (2024) serves up a nostalgic punch of action-packed entertainment
8dbe19c9-673f-44d0-acde-bf51497cba25,Road House,2024,6.2,Action; Thriller,wackoreviews,22 May 2024,Then there's me thinking this was going to be a sprots Rocky-like movie
0284ba44-88a1-4678-9a2f-71a0c3625b14,Road House,2024,6.2,Action; Thriller,eddie578,21 March 2024,Swayze will be turning in his grave
3b0dbf49-ee1c-4050-8dce-3593afd3b51e,Road House,2024,6.2,Action; Thriller,talhatiwana-89119,22 May 2024,Starting felt like it was going to be a great movie but as the story paced it got more and more bad and basic
15179e7f-d437-4765-9dd0-9f1dadcd7e7d,Road House,2024,6.2,Action; Thriller,moonheart,5 May 2024,I wasn't really interested in watching this reboot
0455b993-393d-444c-b14e-c5c3368671d9,Road House,2024,6.2,Action; Thriller,S-John-hall,22 March 2024,"The film is beyond terrible and the acting even from Jake Gyllenhaal seems off, The dialogue is beyond terrible to the points where Jake Gyllenhaal asked (in the movie) is roadhouse, two words or one"
9cbe7b37-c1da-417a-baf8-48e4ea477f25,Road House,2024,6.2,Action; Thriller,tylerrosin,21 April 2024,"The modern adaptation of ""Road House"" was a pleasant surprise, offering a fresh take on the classic film while providing an entertaining experience"
6803051e-b0eb-4ed1-a54d-a8017ae138d3,Road House,2024,6.2,Action; Thriller,wksrbkqd,2 April 2024,"Having never seen the original, I went into this movie with no comparisons or expectations"
91a15a71-1c21-489f-b982-10419d77a012,The Substance,2024,7.7,Drama; Horror,maria_nawrocka,24 May 2024,"12 minutes of standing ovation during Cannes Film Festival premiere, Demi Moore with tears in her eyes saying 'I'm exhausted', and whispers in the festival corridors the day after - 'This might be the Golden Palm'"
0f59afc1-5bbd-429d-a9ca-66862b004071,The Watchers: Eles Veem Tudo,2024,5.7,Fantasy; Horror; Mystery,leestoych,6 June 2024,"""The Watchers"" provides an interesting premise at face value"
0a1a47eb-e888-4d8c-b6fc-9aa4d56b3227,The Watchers: Eles Veem Tudo,2024,5.7,Fantasy; Horror; Mystery,jtindahouse,6 June 2024,I think it's so wonderful that M
18c74ef6-b203-48fe-ac1d-03796e5c1bb5,The Watchers: Eles Veem Tudo,2024,5.7,Fantasy; Horror; Mystery,redaste97,6 June 2024,Many movie critics are predictable
df5f82e6-b0af-428e-b2fb-8ea7da34f57c,The Watchers: Eles Veem Tudo,2024,5.7,Fantasy; Horror; Mystery,poldc,6 June 2024,I enjoy movies with a good story and rich world-building
c2366414-5789-4bdf-9b67-eb4b41245fac,The Watchers: Eles Veem Tudo,2024,5.7,Fantasy; Horror; Mystery,steveinadelaide,7 June 2024,"Writer-director Ishana Night Shyamalan, daughter of the iconic M"
0a4794a2-a677-4488-bf90-7ebfc1fce371,The Watchers: Eles Veem Tudo,2024,5.7,Fantasy; Horror; Mystery,mrehacek,6 June 2024,"Mythological soft horror, just the way we like it at Slyamalan family"
98eb9600-731c-4e94-87d8-87373caf76a6,The Watchers: Eles Veem Tudo,2024,5.7,Fantasy; Horror; Mystery,matisms,7 June 2024,"I consider myself as a BIG cinema and movies fan, watched a LOT of movies in my life"
cbc7d808-2b01-4d34-9dd6-b92eb78b706f,The Watchers: Eles Veem Tudo,2024,5.7,Fantasy; Horror; Mystery,jp_91,6 June 2024,"""The Watchers"" is the debut feature of Ishana Night Shyamalan, daughter of director M"
25ae2c25-b915-4fe6-9cc3-3c6ba670faba,The Watchers: Eles Veem Tudo,2024,5.7,Fantasy; Horror; Mystery,chenp-54708,7 June 2024,"""The Watchers"" holds a very good concept for a horror movie with some excellent camerawork, tension, and atmospheres but unfortunately washed up with an unreliable narrative and the not-so-good Shyamalan traits"
5052db78-7e0b-4645-97ca-656f213050e9,The Watchers: Eles Veem Tudo,2024,5.7,Fantasy; Horror; Mystery,sinnerofcinema,7 June 2024,It's refreshing to see fresh original stories
9c4744cc-daf3-4128-95c2-ac163d90d19f,The Watchers: Eles Veem Tudo,2024,5.7,Fantasy; Horror; Mystery,chloehedrick,7 June 2024,I have often thought of this novel since consuming the audiobook in a couple days last year
51711083-0d14-4eeb-b830-41972884846a,The Watchers: Eles Veem Tudo,2024,5.7,Fantasy; Horror; Mystery,barnabaponchielli,7 June 2024,"Imagine the worst of the father's latest movies (I mean, crap like ""Old"", ""After Earth"", ""Split"", ""Glass"" and ""Servant"", just to name a few"
fa3e9e14-ebd7-4d9d-985c-510dcccdb600,The Watchers: Eles Veem Tudo,2024,5.7,Fantasy; Horror; Mystery,leejiseung,7 June 2024,"The jumpscares was so super effective to me, good angles and good volume for the sounds"
06761bcf-3c48-4f7a-96f6-9bc504d75f5d,Mad Max : Além da Cúpula do Trovão,1985,6.2,Action; Adventure; Sci-Fi,bradley-trent,17 July 2009,"This movie was much maligned when it came out in 1985, but that was due to the spectacular qualities of its predecessors, ""Mad Max"" and ""The Road Warrior"
0858bfa9-c17a-4fab-869a-99e53471f6e0,Mad Max : Além da Cúpula do Trovão,1985,6.2,Action; Adventure; Sci-Fi,angelynx-2,20 May 2000,"Who could not love this movie? It's got more imagination than five average postbomb flicks, incredible visual design, enough alternate societies with enough backstory apiece for three more movies (including an aboriginal clan who look like Peter Pan's Lost Boys and speak a dialect you'll be copying for days after you see it), car chases, amazing costumes, one of the most original death-duel sequences ever, Tina Turner, *and* Mel Gibson"
02427b59-f78f-4055-9b66-ed666ceb16d4,Mad Max : Além da Cúpula do Trovão,1985,6.2,Action; Adventure; Sci-Fi,Mike-754,2 June 1999,"The first half of this film -- the part with Bartertown, Thunderdome, etc -- is brilliant, not just a repeat of THE ROAD WARRIOR but a totally new concept, thoroughly fleshed out"
bbea1565-6c9e-4417-b937-f5cd10bc731d,Mad Max : Além da Cúpula do Trovão,1985,6.2,Action; Adventure; Sci-Fi,view_and_review,28 October 2019,Mad Max Beyond Thunderdome was a bigger production than its predecessor: Road Warrior
468aca54-4c77-4cb4-b948-a11f2749063a,Mad Max : Além da Cúpula do Trovão,1985,6.2,Action; Adventure; Sci-Fi,ma-cortes,11 September 2010,"This stirring movie in comic-strip style is packed with unbelievable car stunts , thrills, chills and noisy action "
bdcf2788-0275-47e1-b3a0-2685501c9964,Mad Max : Além da Cúpula do Trovão,1985,6.2,Action; Adventure; Sci-Fi,MBsMidnightGeeks,7 November 2021,The film begins sometime after Mad Max 2 and a nuclear war
c0316fea-c7a3-47fc-bc0b-1d4ef7fdee16,Mad Max : Além da Cúpula do Trovão,1985,6.2,Action; Adventure; Sci-Fi,Captain_Couth,4 June 2004,Mad Max Beyond Thunderdome (1985) was a travesty
595a5bd9-d9ec-45eb-aed3-a9ecc577ee2a,Mad Max : Além da Cúpula do Trovão,1985,6.2,Action; Adventure; Sci-Fi,zetes,23 May 2000,"Sure it's probably the least good of the Mad Max films, but it is still entertaining as heck"
b462dc48-9388-42ea-96f5-87526843719b,Mad Max : Além da Cúpula do Trovão,1985,6.2,Action; Adventure; Sci-Fi,damianphelps,28 February 2021,Why why why did someone think it was a good idea to fill Max Max 3 with a bunch of annoying kids? Its like half way through the movie the crew was switched and they thought they were making Oliver
fb553ac8-ffe3-49f9-8c56-0ad152cb2e06,Mad Max : Além da Cúpula do Trovão,1985,6.2,Action; Adventure; Sci-Fi,hitchcockthelegend,4 March 2008,"Even allowing for my unabashed love of the first two films in the franchise, and sweeping away any sort of biased leanings I might of had for the character of Max, I just can't bring myself to rate at average this cartoonery waste of space that so nearly soils what had gone before it"
4f098739-8bcb-4a87-b2e7-5f1c474b963f,Mad Max : Além da Cúpula do Trovão,1985,6.2,Action; Adventure; Sci-Fi,racr,4 November 1999,This is one of the best teaching instruments for comparative government ever made--and a great action film as well
4bc3a689-d1a5-4abc-90c5-908d2365e15c,Mad Max : Além da Cúpula do Trovão,1985,6.2,Action; Adventure; Sci-Fi,tomgillespie2002,1 September 2015,"From the opening shot of wandering nomad and mulleted anti-hero Max Rockantansky (Mel Gibson), travelling along the endless Australian plains in a makeshift vehicle put together from spare auto-parts and whatever junk he came across on the road and pulled along by camels, we know that the world George Miller created back in 1979 has descended even further into apocalyptic turmoil, and we are now even further from civilised society than ever before"
e81f30a5-9662-4ce3-9081-f7b35bc85845,Mad Max : Além da Cúpula do Trovão,1985,6.2,Action; Adventure; Sci-Fi,Spaz-11,20 April 1999,"When I first saw Mad Max Beyond Thunderdome, I felt disappointed"
a460fa25-31ed-49d4-aaa2-7b546c6be107,Mad Max : Além da Cúpula do Trovão,1985,6.2,Action; Adventure; Sci-Fi,ChubbyChecker,9 September 2018,"True, we don't need another hero, but if we're going to have one it might as well be Mel Gibson back in his prime"
1b754dd8-be75-496f-b92a-e1800d842478,Mad Max : Além da Cúpula do Trovão,1985,6.2,Action; Adventure; Sci-Fi,colinforrer,13 January 2022,"Whether you've seen Fury Road and are back peddling to the beginning of the series to see the original three films, or you're a complete newcomer altogether, I would say skip this one, for now that is"
d010a7c4-240a-4d5a-bc9f-6389d416f834,Mad Max : Além da Cúpula do Trovão,1985,6.2,Action; Adventure; Sci-Fi,whpratt1,19 October 2007,Mel Gibson put his heart and soul into this film and I admire his great acting abilities as the role of Mad Max along with Tina Turner
6a4c0edd-cf3b-43eb-9542-648a5e10be7e,Mad Max : Além da Cúpula do Trovão,1985,6.2,Action; Adventure; Sci-Fi,Gulag-2,6 January 2001,"An excerpt taken by the unofficial site of the movie (my site) to explain to all the IGNORANTS the real truth about MEl Gibson and his relationship with BEYOND THUNDERDOME,the greatest POST-APOCALYPTIC movie of all the times and the best flick in the trilogy "
cfbe94ab-1554-4c41-98d3-dbef7476d950,Mad Max : Além da Cúpula do Trovão,1985,6.2,Action; Adventure; Sci-Fi,philip_vanderveken,5 May 2005,"The Mad Max series ended with this third movie called ""Mad Max Beyond Thunderdome"" and if I'm honest, it was one too many"
c3610536-3c3e-4239-858a-89f4c4b84f0b,Mad Max : Além da Cúpula do Trovão,1985,6.2,Action; Adventure; Sci-Fi,rosanna_rosannadanna,17 August 2006,"Every time I've seen this movie I get the same impression: some parts of it are so amazingly stupid/bad that they crack me up, they aren't intentional, and there are a lot of them; the rest is just plain bad, stupid and/or irrelevant"
5e3cf4f3-fc69-4dba-b712-6ea8375648de,Mad Max : Além da Cúpula do Trovão,1985,6.2,Action; Adventure; Sci-Fi,gabriel@arq.net,27 January 2004,"(* Spoilers Ahead *) In Mad Max, a single police department with a few highway cops and patrolmen maintain civil order in a desolated region of Australia, apparently post-nuclear apocalypse"
3b14843b-8553-4023-8b46-90ee254ff3a7,Mad Max : Além da Cúpula do Trovão,1985,6.2,Action; Adventure; Sci-Fi,MrP823,24 December 2002,Well let's get one thing out of the way right now
a4aec29e-9595-4586-a19f-cda19fdd0d0f,Mad Max : Além da Cúpula do Trovão,1985,6.2,Action; Adventure; Sci-Fi,liamolf,7 October 2005,I am going to keep this review of this film short and to the point
7ad916cc-6bd1-454f-bdcd-14bc89d59324,Os Fantasmas Divertem-se,1988,7.5,Comedy; Fantasy,moonspinner55,28 September 2002,"It may take two or three viewings to warm up to ""Beetlejuice"""
dcc006df-0a5a-49a9-a671-6c062e4b7d74,Os Fantasmas Divertem-se,1988,7.5,Comedy; Fantasy,MeMyselfAndTheBeard,10 April 2020,Considering he's not in the film that much and the film is named after his character he steals the whole show when he appears front and centre
997d75d5-4e51-4869-8e09-d466ee75062a,Os Fantasmas Divertem-se,1988,7.5,Comedy; Fantasy,planktonrules,6 August 2008,This is a great movie to simply watch and enjoy--no need to think or analyze--just enjoy the silliness and cool factor of this nice film
533c6949-9b6d-4f7f-8b43-3d4958cefa92,Os Fantasmas Divertem-se,1988,7.5,Comedy; Fantasy,Smells_Like_Cheese,19 November 2003,"Once again I'm not sure exactly how to start this comment other than to praise Tim Burton, Beetlejuice is a movie that was based on his idea and is still remembered to this very day"
ac9531db-7081-4444-bad0-c1c37db5bed3,Os Fantasmas Divertem-se,1988,7.5,Comedy; Fantasy,Quinoa1984,27 September 2000,This is one of Tim Burton's best films
b39c8a11-4f04-402c-989f-69d58c98a462,Os Fantasmas Divertem-se,1988,7.5,Comedy; Fantasy,Infofreak,7 December 2001,Watching this one more time on TV yesterday reminded me of the first time I saw it all those years ago at the movies when Tim Burton was just the guy who had directed that funny Pee-wee Herman movie
8e2ae3cc-6e29-4d59-946b-b342d765f497,Os Fantasmas Divertem-se,1988,7.5,Comedy; Fantasy,lee_eisenberg,20 September 2005,You gotta figure that only Tim Burton could come up with this
f8fb3f57-d365-48f2-b29e-f3a70b9388f9,Os Fantasmas Divertem-se,1988,7.5,Comedy; Fantasy,awsmpgn,14 November 2021,One of my favourite movies of all time
fb5c0b67-684e-4784-8a28-9e9a2f56654b,Os Fantasmas Divertem-se,1988,7.5,Comedy; Fantasy,JT-27,12 October 1998,Absolutly Hilarious
7f21caa5-93a0-4132-8375-d5dc6c2af967,Os Fantasmas Divertem-se,1988,7.5,Comedy; Fantasy,vcpoltect,7 October 2022,"For me, it's Michael Keaton's interpretation of the title character that makes the picture"
2f5d5793-004f-4411-acd3-58a36a6e37c2,Os Fantasmas Divertem-se,1988,7.5,Comedy; Fantasy,IonicBreezeMachine,16 September 2022,"In the idyllic small town of Winter River, Connecticut, Adam (Alec Baldwin) and Barbara Maitland (Geena Davis) are a happily married couple who are content to fix up their house while on vacation from working the local hardware store"
55fae13f-8529-4bfd-932e-a005e63487f3,Os Fantasmas Divertem-se,1988,7.5,Comedy; Fantasy,pfgpowell-1,9 April 2009,Beetlejuice is one of those films you feel guilty about not liking more
21fe65d5-2ab0-442c-93e8-dac0243f4a34,Os Fantasmas Divertem-se,1988,7.5,Comedy; Fantasy,Pjtaylor-96-138044,8 September 2020,"Despite an interesting premise and several impressive, unsurprisingly strange sight-gags, 'Beetlejuice (1988)' isn't really all that engaging"
7d37a648-45cb-40f3-8f35-7ea08d91ae07,Os Fantasmas Divertem-se,1988,7.5,Comedy; Fantasy,ccthemovieman-1,24 June 2006,This movie always was: 1 - very popular; 2 - very different; 3 - very entertaining; 4 - a very fast-moving hour-and-a-half of a film
9f7f48d6-3a3f-4f32-9d3b-e0b1d6d366cd,Os Fantasmas Divertem-se,1988,7.5,Comedy; Fantasy,TheLittleSongbird,16 April 2010,"Beetle Juice may be strange and oddball at first, but like several films I have seen over the years, it could well grow on you"
b6680080-18b4-4a78-8e48-a561d5b23a99,Os Fantasmas Divertem-se,1988,7.5,Comedy; Fantasy,Peach-2,17 November 1998,Tim Burton's Beetlejuice is a great film
a2a5a7f8-e841-4ba8-bc39-992e3fddd144,Os Fantasmas Divertem-se,1988,7.5,Comedy; Fantasy,dbdumonteil,19 November 2006,"In 1988, prior to the inordinate success of ""Batman"" (1989) which would line his pockets, Tim Burton bequeathed this work which is from his own words: ""a comical version of ""the Exorcist"" told from two dead people's point of view"""
81b95f4d-d06a-4aa0-b3ce-ec785a4078e2,Os Fantasmas Divertem-se,1988,7.5,Comedy; Fantasy,denis888,21 June 2014,"Many older movies date not so gracefully, and when you watch them after awhile, crappy video effects, or bad montage and cutting are so obvious that the whole movie turns sour or very silly"
3f6be1e6-b729-46b8-b935-8a160c62c208,Os Fantasmas Divertem-se,1988,7.5,Comedy; Fantasy,clint-cole,9 December 2005,This is by far Michael Keaton's best performance
f2d9b6b6-1650-4f6f-b1d9-3ddeac53c7c7,Os Fantasmas Divertem-se,1988,7.5,Comedy; Fantasy,Coxer99,16 June 1999,Keaton steals the show as the title character in this off the wall comedy from director Burton
875917fd-ebdc-45da-a119-15e347fd62af,Os Fantasmas Divertem-se,1988,7.5,Comedy; Fantasy,claudio_carvalho,21 October 2006,"In New England, the couple Barbara (Geena Davis) and Adam Maitland (Alec Baldwin) is in love for each other and for their beautiful house"
f8d4efbf-0d65-4bb5-a237-67d23480398d,Os Fantasmas Divertem-se,1988,7.5,Comedy; Fantasy,lsandv,14 October 2020,"Weird and at times boring empty plot which had potential because of the life after death story, some laughs here and there but not so much, nice old-fashioned visual effects though"
b0305eab-eadb-45a0-ba11-1eae2a2f53e0,Os Fantasmas Divertem-se,1988,7.5,Comedy; Fantasy,son_of_cheese_messiah,9 July 2011,This starts very well with an original and interesting take on the afterlife
a47cecf3-67e2-4de2-9af2-a1955f2b93f7,Ezra,2023,6.5,Comedy; Drama,nader_gorgi,10 September 2023,"Well done, well scripted movie that tugs at the heart strings"
f402fd25-f901-4d3d-831c-21b7211c9d31,Ezra,2023,6.5,Comedy; Drama,AfricanBro,27 May 2024,I was pleasantly surprised to find actual comedians here
72ce1aab-ca17-436e-b2ff-c81849ee364c,Ezra,2023,6.5,Comedy; Drama,ferulebezel,22 May 2024,This feels like an autobiography even though it's not stated
53885cf8-e844-4bb0-a090-504a73eadbb5,Ezra,2023,6.5,Comedy; Drama,JohnDeSando,31 May 2024,He's read the New York Times since he was 5 and can eat only with plastic silverware
ce552f1a-977c-4e8f-b7de-2c488cb7ee15,Ezra,2023,6.5,Comedy; Drama,sadethesage,18 September 2023,"I think movies about mental afflictions keep getting better and more helpful to people who suffer from them, as we move away from cartoonish stigma of the late 20th century when it comes to mental illness"
baa207d7-9aee-4253-98fb-6d8eacaa8f66,Ezra,2023,6.5,Comedy; Drama,dukemtaylor,2 June 2024,I definitely don't feel alone in the world although ironically I saw the movie in an AMC all by myself; it was giving Celine Dion
