uuid,movie_name,movie_date,movie_rating,movie_genre,comment_user,comment_date,comment_text
f45622bd-008a-41ea-869f-3bdab74ad766,Dune - Duna,2021,8.0,Action; Adventure; Drama,StiffG,20 August 2022,I dont think I've ever forced myself to watch a movie so much before and this was only because of all the good reviews
d89efb28-4c76-473d-bd0a-10b24568e801,Dune - Duna,2021,8.0,Action; Adventure; Drama,hviid-sabine,22 September 2021,Denis Villeneuve has such an amazing voice
1466e674-27df-4e38-bc39-09bfe8a0a877,Dune - Duna,2021,8.0,Action; Adventure; Drama,mimi0108,2 October 2021,Visual: I don't think I've ever been so impressed in front of a movie
b65b78c7-2f1c-4a8c-9445-e1481e61ec33,Os Estranhos: Capítulo 1,2024,4.9,Horror,Howling_at_the_Moon_Reviews,17 May 2024,I don't want to waste too much energy on this review but I was quite disappointed
d03beec7-8291-4df0-8032-2f0b73cb70ea,Os Estranhos: Capítulo 1,2024,4.9,Horror,aidenshorror,17 May 2024,"In my opinion, this was some pretty sloppy work"
e8ebc28e-fcb1-41c3-a07a-e95b3660fc70,Os Estranhos: Capítulo 1,2024,4.9,Horror,bjannaway,17 May 2024,I was super excited to see this movie as I loved the original and the trailers looked like it kept the creepy vibes of the original
35e1a08d-9e76-4fb7-bb60-c5cf7941aadb,Os Estranhos: Capítulo 1,2024,4.9,Horror,blumjay,18 May 2024,This movie was awful for so many reasons
eacd3cd2-0fb2-4fa1-9325-686d6e6ec99e,Os Estranhos: Capítulo 1,2024,4.9,Horror,drownsoda90,17 May 2024,"""The Strangers: Chapter 1"" follows a young couple who get stranded in an off-the-beaten-path town in Oregon and end up spending the night at an Airbnb lodge in the woods"
91485500-85d2-4722-920c-2a5c17697dd0,Os Estranhos: Capítulo 1,2024,4.9,Horror,User-440710,17 May 2024,My expectations went from high to low after seeing floods of negative reviews
ec8a7ff4-0814-4309-9187-71ab4831aa2d,Os Estranhos: Capítulo 1,2024,4.9,Horror,sylysya,17 May 2024,Terrible movie
0b8dc3ec-38b5-46c1-bde8-a8c424f607af,Os Estranhos: Capítulo 1,2024,4.9,Horror,kmkevinn-64733,15 May 2024,"The Strangers: Chapter 1' embarks on a journey to rekindle the chilling essence of its predecessor, yet it stumbles into the abyss of the overexploited home-invasion genre"
0c9a888d-11f4-472c-896e-85be3a0947e3,Os Estranhos: Capítulo 1,2024,4.9,Horror,jtindahouse,16 May 2024,"I won't lie, when I heard there was a 'Strangers' trilogy in the works I was excited"
0eb15475-9514-46b4-ad9c-804fe0deb23b,Os Estranhos: Capítulo 1,2024,4.9,Horror,cruise01,20 May 2024,3
52513c1c-7962-4451-af5e-d5d7eba7ccf8,Os Estranhos: Capítulo 1,2024,4.9,Horror,kennethoconnor-04873,18 May 2024,"Please do not spend your money watching this in theaters, it should be straight to DVD"
8be0961b-78fb-4932-b312-ce33cc6e92a5,Os Estranhos: Capítulo 1,2024,4.9,Horror,mike_easleyy,22 May 2024,This really is as bad as the reviews are making it out to be
1129bf2c-edde-4076-9f63-547977248100,Os Estranhos: Capítulo 1,2024,4.9,Horror,josh-81494,17 May 2024,"The Gen Z or Millenial actors are really painful to watch, so much that you root for the killers"
47a5fc32-639e-4e7a-bf5c-c8c179dc0e19,Os Estranhos: Capítulo 1,2024,4.9,Horror,junaidir,28 May 2024,I just watched the most underwhelming film of my life
f5fabe4e-9e2d-41f1-ae75-7c4e38dcd39c,Os Estranhos: Capítulo 1,2024,4.9,Horror,ddj-01098,19 May 2024,"It was good,it is very underrated"
c47a0294-ca41-4c96-b06d-c7c5a08a52d4,Os Estranhos: Capítulo 1,2024,4.9,Horror,Pairic,19 May 2024,The Strangers: Chapter 1
cd0fd80a-4a72-4cbf-a6a1-afe32c829937,Os Estranhos: Capítulo 1,2024,4.9,Horror,HardyReviews_,17 May 2024,"The Strangers Chapter 1 follows Maya and Ryan on their way out of town when their car breaks down, they stay at a cabin in the middle of the woods when they're attacked by strangers"
21ac379c-cc14-4aa5-be64-d9ff39c71c32,Os Estranhos: Capítulo 1,2024,4.9,Horror,Beyondtherain,21 May 2024,I have to repost my review because it was deleted for being negative?? Oh well 
ac6f3990-908c-4a1c-a947-dfdcbb8fb274,Abigail,2024,6.6,Horror; Thriller,cyrax-92742,9 May 2024,"This is an entertaining horror movie with comedic elements sprinkled throughout it and everyone in the cast does a pretty good job with the parts they're given but Dan Stevens kills it, he steals the show in every scene he's in, killer lines and he's so damn funny you can't help but laugh"
0b2a2822-2fe9-4184-8c95-8fbec4830291,Abigail,2024,6.6,Horror; Thriller,Sleepin_Dragon,8 May 2024,"A mixed group of criminals kidnap Abigail, a young ballerina, and daughter of a powerful business mogul"
437e2ef0-aa4e-4145-90df-15732cf575e8,Abigail,2024,6.6,Horror; Thriller,HerbieStretch,19 April 2024,"There is nothing in this film that you haven't seen in a number of other films but it manages, thankfully, to deliver"
b9a0737b-a7ad-4a5c-8443-4e3e86cc68de,Abigail,2024,6.6,Horror; Thriller,Coventry,13 April 2024,"The Radio Silence collective, and directors Matt Bettinelli-Olpin and Tyler Gillett in particular, don't take a lot of time off"
90892fa2-549b-4a06-9c98-63bdc8f43a0b,Abigail,2024,6.6,Horror; Thriller,PerryAtTheMovies,20 April 2024,7
a2040cbc-af78-40a0-be42-14ff1094cd00,Abigail,2024,6.6,Horror; Thriller,gsdpjmcdgw,25 April 2024,This is fun - almost in the style of Hammer
e89c6831-0c54-4267-9bc8-eb11bb3ebd71,Abigail,2024,6.6,Horror; Thriller,NYC2TC,6 May 2024,I saw Abigail this weekend
948e162f-b7fa-4396-add7-f3a30cbc4031,Abigail,2024,6.6,Horror; Thriller,liamlovesmovies_,14 April 2024,Just from the trailers alone I was so excited to see this
6590782b-2a63-466d-b9f2-7aa82c110b7c,Abigail,2024,6.6,Horror; Thriller,knoxfan2008,23 April 2024,Everything in this movie is mediocre except the cinematography and the production design
a7d1d8e9-9108-4957-bc84-c0a8356cd280,Abigail,2024,6.6,Horror; Thriller,anyanimeotoho,16 May 2024,It could have been a neat surprise
79f19eb4-7961-4f72-98f1-3ed8cfbf913e,Abigail,2024,6.6,Horror; Thriller,ragingbull_2005,19 May 2024,If is rare for a horror movie to give away it's twist in its trailer
0beaedb4-9fd6-42ab-9839-1f3113f93949,Abigail,2024,6.6,Horror; Thriller,Howling_at_the_Moon_Reviews,19 April 2024,"This was a surprisingly well rounded, well balanced film that I think will quickly settle into a ""comfort horror"" category for many"
a275728f-307f-4bf1-966d-99606964777d,Abigail,2024,6.6,Horror; Thriller,Platypuschow,22 April 2024,Plot
859cd060-315a-4391-a19e-c221f416ee48,Abigail,2024,6.6,Horror; Thriller,lathe-of-heaven,19 May 2024,Just that
7e7b08b9-d329-4f27-be34-20ef5f039503,Abigail,2024,6.6,Horror; Thriller,HarlequinKitty,20 April 2024,"Enjoyable a day later, but on release as I was watching the movie, I kept expecting more"
cd5c638d-f665-46aa-be9f-8b715c4d1266,Abigail,2024,6.6,Horror; Thriller,nscoby93,19 April 2024,From the directors of Ready or Not comes this boring nothingness
4da42a46-c0ea-4d7b-818c-22fde6ace7ae,Mad Max 2: O Guerreiro da Estrada,1981,7.6,Action; Adventure; Sci-Fi,KnightLander,20 June 2005,"After the enormous success of ""Mad Max"" in 1979, it was predictable that a sequel would follow"
83d055fd-0142-4687-8fcd-181b16beeb71,Mad Max 2: O Guerreiro da Estrada,1981,7.6,Action; Adventure; Sci-Fi,ma-cortes,28 February 2010,Violent movie about a futuristic road-warrior cop with high-velocity action and kinetic energy 
0ffbbc26-2979-4819-a627-0d157a8af612,Mad Max 2: O Guerreiro da Estrada,1981,7.6,Action; Adventure; Sci-Fi,jaidev22-1,11 February 2005,Iam a big action move fan and have seen mostly all the best and worst Hollywood action films ever
ff47661d-96d7-476c-b3e3-a3d2fbf22ae3,Mad Max 2: O Guerreiro da Estrada,1981,7.6,Action; Adventure; Sci-Fi,ivo-cobra8,3 October 2015,Mad Max 2: The Road Warrior is a 1981 Australian post-apocalyptic action film directed by George Miller
a57d22be-9112-4478-8ffb-31e948cd1f57,Mad Max 2: O Guerreiro da Estrada,1981,7.6,Action; Adventure; Sci-Fi,Michael_Elliott,15 May 2015,Mad Max 2 (1981)
1cd4cb61-bf62-4390-b926-539d2a496c56,Mad Max 2: O Guerreiro da Estrada,1981,7.6,Action; Adventure; Sci-Fi,Bogmeister,6 August 2005,"But most of all, I remember the Road Warrior"
ca85f593-54bc-4402-b1be-6642e68f9928,Mad Max 2: O Guerreiro da Estrada,1981,7.6,Action; Adventure; Sci-Fi,jiangliqings,1 March 2001,*** 1/2 out of ****
598ac643-7e89-48a9-bf36-e1750124faf3,Mad Max 2: O Guerreiro da Estrada,1981,7.6,Action; Adventure; Sci-Fi,ForTheMostPart1999,8 November 2022,"Well done stunts and camera shots, especially for it's time for sure"
28ba0cad-db85-42ef-aaf9-46e2a16132c0,Mad Max 2: O Guerreiro da Estrada,1981,7.6,Action; Adventure; Sci-Fi,xtonybueno,13 September 2000,My life fades
7ad4dab5-9105-4ef7-975b-896900586ccd,Mad Max 2: O Guerreiro da Estrada,1981,7.6,Action; Adventure; Sci-Fi,Prismark10,6 February 2016,After the success of the low budget but high voltage Mad Max comes the sequel subtitled The Road Warrior
73c577c2-c8a7-4f4b-9cd4-3a9f3cc1b166,Mad Max 2: O Guerreiro da Estrada,1981,7.6,Action; Adventure; Sci-Fi,Lechuguilla,5 April 2016,"It's mostly a high-powered action flick, set in a grim, desolate future wherein gasoline is as precious as gold"
cf8c21e3-2acc-4d91-8542-00adb01d94f9,Mad Max 2: O Guerreiro da Estrada,1981,7.6,Action; Adventure; Sci-Fi,TOMASBBloodhound,12 June 2005,"Studio executives today could use a film like this one, or its predecessor right about now"
ec46326b-2db2-4ba6-b890-30de79181ca5,Mad Max 2: O Guerreiro da Estrada,1981,7.6,Action; Adventure; Sci-Fi,RussHog,11 June 2019,"Seriously, what happened to movies? Modern Hollywood sucks"
a2132f27-86e4-43f4-9e35-0ac2086612fa,Mad Max 2: O Guerreiro da Estrada,1981,7.6,Action; Adventure; Sci-Fi,diglers69,17 March 2019,The original imho is so much better
42bf9199-173a-4405-99eb-4f99bc42be48,Mad Max 2: O Guerreiro da Estrada,1981,7.6,Action; Adventure; Sci-Fi,chaos-rampant,17 August 2015,"Something endears about how this almost never became a franchise, or didn't become one until after this"
33f0c0e3-81d8-42e9-89eb-6eb29b425ffd,Mad Max 2: O Guerreiro da Estrada,1981,7.6,Action; Adventure; Sci-Fi,Samiam3,11 August 2010,"Mad Max 2, or the Road Warrior if you will, begins with something that the first Mad Max probably should have started with; a little setting exposition"
6c9d51c0-2411-4dc1-8d7f-c1f9132d5048,Mad Max 2: O Guerreiro da Estrada,1981,7.6,Action; Adventure; Sci-Fi,jokeco68,21 December 2004,The first time I saw this at a friends recommendation was in 1985 on our brand new VHS vcr
852e2736-27a6-40fb-a920-52ad1d5d3b48,Mad Max 2: O Guerreiro da Estrada,1981,7.6,Action; Adventure; Sci-Fi,kosmasp,19 May 2015,"There is a nice introduction on the disc that explains why this wasn't originally called ""Mad Max 2"""
a54610ff-15bf-47da-9b95-c6da4c806061,Mad Max 2: O Guerreiro da Estrada,1981,7.6,Action; Adventure; Sci-Fi,knsevy,2 May 2003,I think this may be the greatest 'car movie' ever made
f155373c-587b-4492-984b-d061c0157091,Mad Max 2: O Guerreiro da Estrada,1981,7.6,Action; Adventure; Sci-Fi,paul_haakonsen,30 August 2014,"Compared to the first movie, then ""Mad Max 2: The Road Warrior"" was a major improvement, not only in entertainment value, but also in story, execution and atmosphere"
2c0937c1-e165-4486-9df1-a996c9345799,Mad Max 2: O Guerreiro da Estrada,1981,7.6,Action; Adventure; Sci-Fi,Movie_Muse_Reviews,3 August 2008,"Brutal, savage and animalistic, George Miller's ""The Road Warrior"" is a much more fully developed imagining of a post-apocalyptic Australia where gasoline equals power than its predecessor, ""Mad Max"" a much sloppier science-fiction experiment"
6d28094b-48bc-4e1a-bdfc-741f2572017a,A Mãe da Noiva,2024,4.8,Comedy; Drama; Romance,stephensdelicia-95654,10 May 2024,I usually like light rom-com movies but this one was not all that great
d7b3cdbe-b99f-4e61-b743-a3569263d53c,A Mãe da Noiva,2024,4.8,Comedy; Drama; Romance,susiegaynormcgowan,12 May 2024,"When you watch a rom com you can nearly expect what's going to happen, this is no different"
b9da860a-dd61-4957-83d2-4b2f914505ce,A Mãe da Noiva,2024,4.8,Comedy; Drama; Romance,klauzbiomed,10 May 2024,"I knew it was a predictable movie, but the script and the acting is so bad executed that it becomes impossible to buy the story"
ddeecf72-2af7-4e50-af09-4cd8316b8d16,A Mãe da Noiva,2024,4.8,Comedy; Drama; Romance,terrylarosa,10 May 2024,After suffering through Anyone but You that was as unfunny as you can get we get another massively unfunny rom com
fcf2b9cc-e25f-4d19-897d-9a2209c149a4,A Mãe da Noiva,2024,4.8,Comedy; Drama; Romance,Ina_L,10 May 2024,"This movie is nothing special one tipical romantic comedy movie that fallows two couple stories that are connected, but it is mostly focused on second chance trope"
825f64d0-b0e7-4947-825c-275df9b0b58d,A Mãe da Noiva,2024,4.8,Comedy; Drama; Romance,MickyG333,11 May 2024,6
6fe42cc8-d525-4257-a217-baa20bef021b,A Mãe da Noiva,2024,4.8,Comedy; Drama; Romance,lottie-lc,9 May 2024,"Very lame script, poor acting, overall boring and underwhelming"
16ddef03-0a92-47c7-920d-1b36fb95e09b,A Mãe da Noiva,2024,4.8,Comedy; Drama; Romance,info-37833,10 May 2024,"Can everybody just relax and be entertained, please? There is no need for every movie to reinvent the wheel"
4ee16233-819d-47fe-a4e1-32e3941e7b08,A Mãe da Noiva,2024,4.8,Comedy; Drama; Romance,wehling-77680,13 May 2024,"My wife, the Rom Com fan of the family, rates this a seven"
a68d3d0d-7abd-454d-954f-0af22e77c05e,A Mãe da Noiva,2024,4.8,Comedy; Drama; Romance,paolaachicanoy,12 May 2024,Please don't waste your time watching this movie
da78bebc-d311-4646-8a9f-9066135a65c5,A Mãe da Noiva,2024,4.8,Comedy; Drama; Romance,mls4182,12 May 2024,"At first, I thought this was a reality TV show I had turned on"
f5813e20-4dc2-4d25-b60e-e9bc36cb3a48,A Mãe da Noiva,2024,4.8,Comedy; Drama; Romance,phildeesnow,9 May 2024,"I thought that Hollywood wasn't doing this anymore, Deep Impact, Armageddon, Dante's Peak, Volcano and I could continue"
ca154738-ff3c-46a7-a1f6-824fa7a83166,A Mãe da Noiva,2024,4.8,Comedy; Drama; Romance,catrine-48845,11 May 2024,I really like Brooke shields so I was looking forward to watching this
0a6181ff-5663-4b80-bb5c-90b4da57c4cc,A Mãe da Noiva,2024,4.8,Comedy; Drama; Romance,casualviewer-92163,12 May 2024,"Im giving 3 stars only because Sean Teale is such an eye candy, otherwise this movie is terrible"
c6e28829-f028-4e3c-89fa-34b510e641b2,A Mãe da Noiva,2024,4.8,Comedy; Drama; Romance,Dillydaydream,13 May 2024,This was awful- cringe making
33d46077-2ab9-4fc5-8408-3d9be3d13b4c,A Mãe da Noiva,2024,4.8,Comedy; Drama; Romance,shantecool,14 May 2024,"Frankly, I enjoyed it from beginning to end"
615fcea1-a543-48c7-b8c4-0c20e9b56736,A Mãe da Noiva,2024,4.8,Comedy; Drama; Romance,sheila-13239,25 May 2024,"Over-acting and weak plot lines weigh this down, but"
f68bf66b-f4d0-4ed6-869f-0706e234da00,A Mãe da Noiva,2024,4.8,Comedy; Drama; Romance,tsora-90756,11 May 2024,"If you have seen Ticket to Paradise I will recommend you just ignore this movie, if you even heard about it to begin with"
7306a92e-ccb8-414b-afa6-5191912adce1,A Mãe da Noiva,2024,4.8,Comedy; Drama; Romance,gpwdxrfv,11 May 2024,"There is not an original thought in this entire movie, like someone watched every rom com from the 90's, removed all the stereotypes and cliches and cut them together along with some badly named 'designers' (Take a first name, say it, then add a 'la' and repeat the first name)"
22110d10-85e5-4c81-964b-941af19bbc5d,Back to Black,2024,6.4,Biography; Drama; Music,marcovinicio-74921,14 April 2024,"Amy Winehouse had a tumultuous life, full of success and drama, but this film does no make justice to her legacy"
22c6fd1c-b453-440a-a6ff-9622abc5c94c,Back to Black,2024,6.4,Biography; Drama; Music,epaulguest,7 May 2024,Amy Winehouse's life was inherently dramatic
34003064-1b2f-4a3e-a077-60ddea047c99,Back to Black,2024,6.4,Biography; Drama; Music,cutie7,11 April 2024,"""Back to Black"" delivers a heartfelt tribute to Amy Winehouse, brilliantly capturing the essence of an icon whose talent and personal struggles left an indelible mark on the music world"
84b33bfa-d523-4186-b28c-806490ad8699,Back to Black,2024,6.4,Biography; Drama; Music,morkoff,16 April 2024,Amy Whinehouse was a rather personal celebrity for me since my teen years
c8de2c28-5bd6-4e78-bebd-a0c14238f373,Back to Black,2024,6.4,Biography; Drama; Music,dejtaxi,14 April 2024,The film captures the self destructive and addictive demons that surrounded Amy Winehouse and I think doesn't truly depict the character portrayal of her husband and father as they are shown as better characters than they were
910b900b-9d48-487d-ba76-aefa5f64a3fa,Back to Black,2024,6.4,Biography; Drama; Music,dmoonage,13 April 2024,"I went into this movie not expecting much, thanks to the reviews, but figured I'd like to see a recreation of London in the 2000s"
16b1d26b-2d3a-4515-a343-bce7a64f63cb,Back to Black,2024,6.4,Biography; Drama; Music,CinemaSerf,11 April 2024,"Truth, if it were needed, that Lesley Manville can turn her hand to anything, but otherwise this is a rather unremarkable biopic of a woman whose character, I must confess, I didn't actually like very much"
f5a88856-2310-4d4e-8b1c-0dc0de198548,Back to Black,2024,6.4,Biography; Drama; Music,thepiczr,2 May 2024,Poor casting choice all around
083b926f-60ce-4d4a-8d8c-364b48630887,Back to Black,2024,6.4,Biography; Drama; Music,steveinadelaide,13 April 2024,Back to Black isn't just a biopic; it's a raw exploration of a singular talent battling inner demons
4ef24909-e47e-46ad-b686-84980f188a0d,Back to Black,2024,6.4,Biography; Drama; Music,glyn-87218,14 April 2024,"The performance by Marisa Abela is brilliant, she is Amy Winehouse"
ee8394bb-9a0b-477c-8f51-d8fdf435d6b9,Back to Black,2024,6.4,Biography; Drama; Music,southdavid,15 April 2024,"Intriguingly ""Back to Black"" seems to be a film that is finding little consensus amongst the professional reviewers"
50ff379d-5bee-416c-88b1-81ea8d5579f9,Back to Black,2024,6.4,Biography; Drama; Music,ethanbresnett,1 May 2024,Like a lot of recent biopics Back to Black does a perfectly fine job but fails to really provide great depth or insight into its subject
338dcd0e-28d7-4b18-bbac-8cf2805f12a7,Back to Black,2024,6.4,Biography; Drama; Music,r96sk,16 April 2024,'Back to Black' is not the best
39127eaf-9b53-40e5-a05c-157e288906bf,Back to Black,2024,6.4,Biography; Drama; Music,TomTalksFilms,18 April 2024,Director Sam Taylor-Johnson finds herself going from Grey to Black for this Amy Winehouse Biopic
48f1472f-80bf-476f-972f-516f11939468,Back to Black,2024,6.4,Biography; Drama; Music,mezzaitaliana-89131,26 April 2024,"Marisa Abele saves this film, her performance was excellent"
7b29b9aa-9c2b-43ba-b948-1dd6c8ce6b9d,Back to Black,2024,6.4,Biography; Drama; Music,toddmwilmsSF,18 May 2024,"Tl; DR - The lead's portrayal of Winehouse is spot-on, with her own vocals adding an authentic touch"
084e521a-8d1d-4d7c-810c-d95f29066ec0,Back to Black,2024,6.4,Biography; Drama; Music,SamJamie,1 May 2024,"Singer Amy Winehouse wrote and recorded the groundbreaking album ""Back to Black"" inspired by her tumultuous relationship with Blake Fielder-Civil"
169886f5-beaa-4f37-a4b3-96e94ded8eda,Back to Black,2024,6.4,Biography; Drama; Music,sidneysiobhan,16 April 2024,Classic IMDB- Audience
30e915c1-62a8-4460-ae9e-edb0d883fd1f,Back to Black,2024,6.4,Biography; Drama; Music,geo-m80,9 May 2024,I'm on the side who don't see how people can call this a bad movie
9aa72678-18f4-45dd-82e5-974d65e0e9bf,Back to Black,2024,6.4,Biography; Drama; Music,stevencayer,22 May 2024,Here we go again with another biopic
c4bd6127-46b2-437e-bc03-af419d8d507e,Unfrosted,2024,5.5,Biography; Comedy; History,brettkdobbs,4 May 2024,"Maybe I built up ""Unfrosted"" too much, in my mind"
0f5354b8-4b86-45ee-8755-ccbd5ae97025,Unfrosted,2024,5.5,Biography; Comedy; History,spoonerstreet,4 May 2024,All you need to know about this movie is that the world's greatest comedian decided that writing a cow fart joke into this movie was a good idea
41207ec3-53d2-477f-93d7-f7f0dd51e4cc,Unfrosted,2024,5.5,Biography; Comedy; History,henry8-3,4 May 2024,Jerry Seinfeld directs and stars as Bob in the extremely made up story of the creation of Kelloggs' Pop Tarts
5b0f1483-2679-4084-a30a-cc66061dffcc,Unfrosted,2024,5.5,Biography; Comedy; History,daverph,20 May 2024,Kept me from
73697d3d-0f13-41f8-ba3e-bd892f69d189,Unfrosted,2024,5.5,Biography; Comedy; History,RedMars2017,3 May 2024,"This feels like that Dick Turpin series on Apple TV: proof that no matter how talented the cast of comedians, if the script ain't funny, it ain't funny"
09cc3924-9090-4669-b1da-00f61b63cafc,Unfrosted,2024,5.5,Biography; Comedy; History,kookookeedoo,9 May 2024,Is this the funniest movie I've ever seen? No
8cf01cbb-e920-4c56-b015-6cfa6610c607,Unfrosted,2024,5.5,Biography; Comedy; History,The_Bigstinker,25 May 2024,The one thing this was able to do right was make me eat a pop tart the next morning (I eat one almost every morning)
0dfaf251-4ddc-4f10-8152-caabeb6f8730,Unfrosted,2024,5.5,Biography; Comedy; History,passenger70,3 May 2024,This a really funny film but the drawback is that the references are all so specific to the early 60's (with a few anachronisms) that a lot of younger reviewers will have their hair parted by the sheer volume of jokes going over their heads
a4eb37e2-6286-42ab-82c9-0b033aded183,Unfrosted,2024,5.5,Biography; Comedy; History,mukesh-jethwani,5 May 2024,I wanted to like it so bad
f97da2cd-cdfc-447f-9b79-5891cacbcf4c,Unfrosted,2024,5.5,Biography; Comedy; History,Wiebkewestedt,4 May 2024,"This has a lot of funny references, it's definitely entertaining"
2e3f8381-63e0-4356-853c-54cf9b14121f,Unfrosted,2024,5.5,Biography; Comedy; History,gehete-40949,3 May 2024,Pretty much the worst criticism you can lay on to a comedian but it is true
252e1eba-e904-41ff-87cd-0090114664a5,Unfrosted,2024,5.5,Biography; Comedy; History,colin-411,4 May 2024,"This film is both terrifically funny and terrifically stupid, simultaneously"
80c0ef74-7bf4-4c77-a59d-f833766f4d74,Unfrosted,2024,5.5,Biography; Comedy; History,olavoll,3 May 2024,"It is what it is - a 7/10 silly family comedy with a bunch of comedy stars and familiar faces, nothing more and nothing less"
8ad5cfc7-1192-4a1e-a395-2f759fd7028b,Unfrosted,2024,5.5,Biography; Comedy; History,dedawson-82561,5 May 2024,This is like a movie made to include all the banter in the writers' room for a sitcom
3e08a207-2e36-4af9-aae3-af1306240e93,Unfrosted,2024,5.5,Biography; Comedy; History,johnl1957,20 May 2024,This is just a fun movie
ca78785f-4360-4ec6-9b99-c48a8c1521eb,Unfrosted,2024,5.5,Biography; Comedy; History,jbrassar-1,5 May 2024,"Jerry Seinfeld should have stayed home and sit on his money instead of producing, directing and leading in this pile of frosty and unfunny, unfrozen mishmash of nonsense"
d38530b6-8333-467f-8a4d-7c8d38db0cf7,Unfrosted,2024,5.5,Biography; Comedy; History,katyquinlan,3 May 2024,"""Official"" critics losing their minds & giving subpar reviews only solidifies that they take themselves far too seriously"
38e26c49-22df-4f2d-81de-40865d438d2e,Unfrosted,2024,5.5,Biography; Comedy; History,left_d_right,23 May 2024,This movie feels like it's trying too hard to be funny without taking any risks
55d7ac95-a2f5-4b92-8e14-cd2c631462d0,Unfrosted,2024,5.5,Biography; Comedy; History,djv7515,6 May 2024,"This movie had a lot of funny dialogue and actors, but it was very uneven; going from funny to stupid, often in the same scene"
ed4fa4c7-9e42-489e-a1a1-a1bfcc9c8655,Unfrosted,2024,5.5,Biography; Comedy; History,sdavid-41660,30 May 2024,This film answers the question whether the real Jerry Seinfeld is funny - and the painful answer obvious to anyone watching Unfrosted is a long overdue no
8c858a57-37db-4580-a0f0-92b6cbac55b9,Unfrosted,2024,5.5,Biography; Comedy; History,zeljan,4 May 2024,"It does not seem to matter to Jerry that he has created ""Unfrosted"" for a niche audience - his own generation"
c32a6ce4-79fc-4716-8a92-66176f1cae14,Unfrosted,2024,5.5,Biography; Comedy; History,reluctantdante,3 May 2024,Amazing actors could not have been butchered worst
4670547a-2193-4587-91b9-f319a05f5ffc,Unfrosted,2024,5.5,Biography; Comedy; History,kimbpaul,10 May 2024,"It's 2am, I can't sleep, landed on this"
e3d5dcbb-bef2-4522-a88a-166f34be49a1,Unfrosted,2024,5.5,Biography; Comedy; History,Guedouara,23 May 2024,"""Unfrosted: The Pop-Tart Story"" promised to be a quirky and entertaining dive into the creation of one of America's favorite breakfast treats, but it falls flat in almost every regard"
c50d169a-358a-43bf-894b-d049432660ba,Megalopolis,2024,6.9,Drama; Sci-Fi,cdeligia,18 May 2024,Megalopolis is a cinematic tour de force that unflinchingly dissects the precarious state of contemporary American democracy through a chilling parallel with the fall of the Roman Empire
3c5b682f-581a-4d32-a7da-460022d54c44,Megalopolis,2024,6.9,Drama; Sci-Fi,screenworld,17 May 2024,"Just as the fallen Rome fell, the movie ""Megalopolis"" is a hopeless story against a dark background"
eaaad9c2-50af-4f5e-a3de-a9e74f365280,Megalopolis,2024,6.9,Drama; Sci-Fi,Agentman00,17 May 2024,"Rome wasn't built in a day as the saying goes, a truism summating that the city (or any city) wasn't built by one person's vision and even less the actual work and efforts of its construction"
887073a7-327d-4588-ad4e-5cc09c642045,Oppenheimer,2023,8.3,Biography; Drama; History,Orlando_Gardner,19 July 2023,You'll have to have your wits about you and your brain fully switched on watching Oppenheimer as it could easily get away from a nonattentive viewer
89574b13-60cb-4239-8d14-9f073567c851,Oppenheimer,2023,8.3,Biography; Drama; History,Bonobo13579,21 July 2023,I'm a big fan of Nolan's work so was really looking forward to this
42f6b893-4fe4-4626-8414-cf35a37f608e,Oppenheimer,2023,8.3,Biography; Drama; History,mark-217-307033,19 July 2023,"I'm still collecting my thoughts after experiencing this film, Cillian Murphy might as well start clearing a space on his mantle for the Best Actor Oscar"
