uuid,movie_name,movie_date,movie_rating,movie_genre,comment_user,comment_date,comment_text
7ec5ba46-9b05-4d4a-90da-cbb504c48012,Furiosa: Uma Saga Mad Max,2024,7.9,Action; Adventure; Sci-Fi,jethro-17881,23 May 2024,George Miller
bbdef862-d590-4c22-b81c-ad08dfba30ef,Furiosa: Uma Saga Mad Max,2024,7.9,Action; Adventure; Sci-Fi,alwinsup,23 May 2024,Pretty good movie
1a5aa676-39a6-43f4-a7e7-b8ef093e90b0,Furiosa: Uma Saga Mad Max,2024,7.9,Action; Adventure; Sci-Fi,masonsaul,25 May 2024,It would be folly to try and outdo Fury Road and Furiosa: A Mad Max Saga is smart enough to not even attempt that
b837885d-46b7-4d9d-8aaf-b2b1881c2a83,Furiosa: Uma Saga Mad Max,2024,7.9,Action; Adventure; Sci-Fi,kanhalangsycamden,25 May 2024,"I feel many go into Furiosa expecting a Mad max movie, and at its core it is so much different"
1ab5718d-cff9-4861-be42-47029cc0c803,Furiosa: Uma Saga Mad Max,2024,7.9,Action; Adventure; Sci-Fi,jinxedmihai,22 May 2024,I just finished watching the movie premiere here in my country and i was soooo satisfied
e42e63fb-36f0-4b33-a23c-4392e26f8202,Furiosa: Uma Saga Mad Max,2024,7.9,Action; Adventure; Sci-Fi,Ratingzzz,22 May 2024,"From start to finish, Furiosa is filled with heart-pounding action sequences, breathtaking visuals, and a captivating storyline"
d0254a9a-26bd-4a99-8c48-adcbf4c16e70,Furiosa: Uma Saga Mad Max,2024,7.9,Action; Adventure; Sci-Fi,ZeroDucks,23 May 2024,Furiosa would be easier to watch if Fury Road never happened
c0c1ab0c-0fc0-4c73-9a8c-d938b5da8d78,Furiosa: Uma Saga Mad Max,2024,7.9,Action; Adventure; Sci-Fi,shamileliyev,25 May 2024,"""Furiosa"" is an exhilarating addition to the Mad Max franchise that masterfully blends intense action, compelling storytelling, and stunning visuals"
9fc9ed6b-0fdb-4b39-960d-1f980c0409aa,Furiosa: Uma Saga Mad Max,2024,7.9,Action; Adventure; Sci-Fi,johannes-stal,22 May 2024,"Max Mad fan here, I would rate previous movies: Mad Max around a 6, Road Warrior 8 Thunder Dome 7 Fury Road 9 and speaking of Fury Road"
732103d5-7da4-45c5-bdec-46907242d15f,Furiosa: Uma Saga Mad Max,2024,7.9,Action; Adventure; Sci-Fi,dam-24421,19 May 2024,"When I say breaking bad, LOTR is a 10, and I give this a 8, thats an amazing score and compliment"
f2d50bef-5299-4cdb-895e-35c3d19370b5,Furiosa: Uma Saga Mad Max,2024,7.9,Action; Adventure; Sci-Fi,EpicCthulhu,23 May 2024,"While Fury Road boasted impressive stunts and action set pieces, Furiosa unfortunately over-relies on poor CGI and green screen for all its action scenes, completely detaching viewers from any sense of immersion"
78cb3d28-85c3-43e1-82dc-66f4c6ac0d78,Furiosa: Uma Saga Mad Max,2024,7.9,Action; Adventure; Sci-Fi,and_mikkelsen,24 May 2024,However does it mean this movie is bad? No
9b14043a-db8a-435e-9c8f-d328914ef7e8,Furiosa: Uma Saga Mad Max,2024,7.9,Action; Adventure; Sci-Fi,dobberen,25 May 2024,I loved this movie
87a27fc7-1b86-43d7-ac0e-0d2e1983d868,Furiosa: Uma Saga Mad Max,2024,7.9,Action; Adventure; Sci-Fi,cdjh-81125,29 May 2024,One of my biggest unpopular movie opinions is that I'm just not that crazy about Mad Max: Fury Road
0ce60a6f-a99f-4eca-a3d0-99f49a016f38,Furiosa: Uma Saga Mad Max,2024,7.9,Action; Adventure; Sci-Fi,kmkevinn-64733,15 May 2024,"In the desolate yet visually stunning landscape of George Miller's latest masterpiece, ""Furiosa: A Mad Max Saga,"" the audience is thrust into a maelstrom of high-octane action and profound storytelling"
e866b283-1cd6-45e5-839c-0747b0e01199,Furiosa: Uma Saga Mad Max,2024,7.9,Action; Adventure; Sci-Fi,kardayathomas,24 May 2024,"If you're expecting a non-stop, fast paced, high octane movie like Fury Road you'll be sadly disappointed with this outing"
be12e20f-9a02-4ac0-91bb-e134d33ce90d,Furiosa: Uma Saga Mad Max,2024,7.9,Action; Adventure; Sci-Fi,damianphelps,23 May 2024,One of the great movies
677b3604-d411-49f7-8acf-703af9200f1b,Furiosa: Uma Saga Mad Max,2024,7.9,Action; Adventure; Sci-Fi,Fosse9rim,23 May 2024,"A weak repeat of its original version that is extremely boring, devoid of content, and even lacks the appeal of real action"
5c0a522e-1579-4e0a-a024-1192239858cb,Furiosa: Uma Saga Mad Max,2024,7.9,Action; Adventure; Sci-Fi,albertregist,26 May 2024,"I love all of the Mad Max films, most of all Fury Road, but overall, I found Furiosa to be just alright"
1d4f3850-a656-4eea-b1b7-28e8815a556d,Furiosa: Uma Saga Mad Max,2024,7.9,Action; Adventure; Sci-Fi,ryanjohnsoniowa,15 May 2024,"I didn't think they could top Fury Road, but they did"
e8a8e0d2-4535-42a7-b3ed-ca61daa118f4,Furiosa: Uma Saga Mad Max,2024,7.9,Action; Adventure; Sci-Fi,moviemanmo973,25 May 2024,Furious at this prequal
b9f0a119-d6ac-4020-bc2b-40e0be71320c,Furiosa: Uma Saga Mad Max,2024,7.9,Action; Adventure; Sci-Fi,andrewchristianjr,22 May 2024,A badass female revenge story with a character who can only trust herself in the game of survival
61102ddf-bd66-4115-be48-ac5855a56dd8,Atlas,2024,5.6,Action; Adventure; Drama,bwgood77,24 May 2024,"Seeing Atlas starring Jennifer Lopez pop up on Netflix doesn't necessarily leave you with a lot of hope that it's going to be a good movie, but I surprisingly liked it much more than I expected"
e7465736-4a50-4770-bc06-5946efc0b23c,Atlas,2024,5.6,Action; Adventure; Drama,datcherson,25 May 2024,Was it great no
2cd0a0a5-7bf7-4cdb-8530-ad1f05a349dc,Atlas,2024,5.6,Action; Adventure; Drama,benjaminprins,25 May 2024,"If you are a sci-fi fan and are known with the Titanfall game series, this movie will be very surprising"
91eea9bd-b3c8-477e-a392-70d0b9ce4429,Atlas,2024,5.6,Action; Adventure; Drama,Tomaslillebror,26 May 2024,I kept asking myself throughout the movie wether Jennifer Lopes character was adapted for her or if Jennifer Lopes adapted to the character
212d592d-5731-44e7-a912-17ec534b3fc4,Atlas,2024,5.6,Action; Adventure; Drama,chursyheli,27 May 2024,**Movie Review: Atlas**
d8492ff3-cd75-4727-8d64-8a2e4f3d559b,Atlas,2024,5.6,Action; Adventure; Drama,darrenn,24 May 2024,"Brad Peyton seems to be another one of these directors that Hollywood keeps throwing money at for mediocre formulaic movies, almost certainly written with AI now, trading on big star names & flashy soulless CGI"
c1d0eec4-750a-41d6-ae66-d147e27e53ab,Atlas,2024,5.6,Action; Adventure; Drama,pensman,24 May 2024,The writers latch onto a current concern: what happens if AI develops to a point where it decides it's time for us to go and it's bye-bye humanity
0ee4ac91-577e-4bbe-b6ed-c2f1bfdd5389,Atlas,2024,5.6,Action; Adventure; Drama,barbosa_antonio,27 May 2024,A good idea was laid to waste by such poor acting
2eb9a146-d5ce-441f-9dbb-97468d05f016,Atlas,2024,5.6,Action; Adventure; Drama,kaefab,24 May 2024,Why was Jennifer Lopez casted in this movie? But in the end she is not that bad
912203bd-be50-4e92-a3e0-50071f06f5d8,Atlas,2024,5.6,Action; Adventure; Drama,sheilaodonovan-71594,25 May 2024,I often leave the cinema if I'm not enjoying the film
c2b6d914-6977-4428-afb8-2328c3ba6685,Atlas,2024,5.6,Action; Adventure; Drama,horstbegerak,25 May 2024,I had fun watching it
f70297a3-10b1-4b2c-8167-5657d8daba02,Atlas,2024,5.6,Action; Adventure; Drama,ubikcorp,25 May 2024,I have no idea why some reviewers are panning Jennifer Lopez' acting
6d0d5bc3-e03d-48f3-8e23-dccb3d0548f0,Atlas,2024,5.6,Action; Adventure; Drama,TMAuthor23,24 May 2024,"For those wondering how Jennifer Lopez managed to get cast in the lead role for this film, a role she is completely wrong for"
a1208e0f-f9a2-4acb-93b7-3c77d430e809,Atlas,2024,5.6,Action; Adventure; Drama,cahidi,31 May 2024,I just don't get what made a lot of people kept on hating J-Lo
96bf1fa3-727b-4a7b-8a74-ef91ebc2fc33,Atlas,2024,5.6,Action; Adventure; Drama,johnnychicago-75285,24 May 2024,That was one of the movies where I'm glad I wasn't sitting in the theater
663500ae-15bf-48dd-aa48-338c83f07f9f,Atlas,2024,5.6,Action; Adventure; Drama,fountainofjuice,26 May 2024,I'm not sure why there are so many sub-par ratings
4b25f0a9-7176-468d-861a-a3a9b563f208,Atlas,2024,5.6,Action; Adventure; Drama,ferguson-6,24 May 2024,Greetings again from the darkness
379ec000-59e6-4458-9022-74fdfa606eef,Atlas,2024,5.6,Action; Adventure; Drama,arsalanweb,25 May 2024,Atlas is a cinematic venture that aims high and largely succeeds in delivering a visually striking and emotionally resonant experience
81d99074-2e3b-4e56-b8f9-24b6bb4a7f6e,Atlas,2024,5.6,Action; Adventure; Drama,vitalymakievsky,25 May 2024,The movie starts out great
54366502-9e0b-405b-bc00-5bb3f487c52e,Atlas,2024,5.6,Action; Adventure; Drama,fat_gibberish_monkey,26 May 2024,Now let's first set some realistic expectations
fb3f14d7-3af2-4faf-a1a5-483d3c759b00,Atlas,2024,5.6,Action; Adventure; Drama,jared-25331,24 May 2024,"For the past couple of years, Netflix has been released a lot of Action Blockbusters onto their streaming service"
5abf17bf-90d3-472e-a35b-7ddfdf01f7bf,Guerra Civil,2024,7.3,Action; Adventure; Thriller,clarejoshua,11 April 2024,I loved the concept of the film and some elements of this film delivered but unfortunately as a full experience it fell short for me by some distance
93fede6f-76a8-499c-9e99-382c0c8d618d,Guerra Civil,2024,7.3,Action; Adventure; Thriller,billthomas,12 April 2024,There is a good movie to be made about the polarisation and aggression of US politics leading to civil war
5cbbfa7a-9b00-495e-a3e5-b0670531ea18,Guerra Civil,2024,7.3,Action; Adventure; Thriller,ItsJonThompson,24 April 2024,"A truly immersive experience into what a civil war in an America could ""feel"" like"
b8e77165-3ae6-4920-828e-569100b64b44,Guerra Civil,2024,7.3,Action; Adventure; Thriller,ramair350,13 April 2024,Everybody should see this film
275d5f5f-82b3-41c2-8453-9153888d9037,Guerra Civil,2024,7.3,Action; Adventure; Thriller,mark-deckard-1967,13 April 2024,America is getting sick
9958d588-a858-416f-8acd-18af1794bdc6,Guerra Civil,2024,7.3,Action; Adventure; Thriller,aceshop3,6 April 2024,Let me start with: the discourse around this film is truly fascinating-and I think it's incredible to read this some time after watching the movie
dc802080-422d-4fcd-b88c-60d67267eabc,Guerra Civil,2024,7.3,Action; Adventure; Thriller,davejensen-97995,12 April 2024,The director has prepared us for a movie about how the differences in our political spectrum have led to a civil war
118cb1c6-eb44-4810-9690-9b40b2e094d4,Guerra Civil,2024,7.3,Action; Adventure; Thriller,randbark-2,25 May 2024,As the title says
635c38e3-49ab-4dbc-a337-e5a4a5055d0e,Guerra Civil,2024,7.3,Action; Adventure; Thriller,murray-allison94,27 April 2024,On the good side there's some very good cinematography
0d9c871c-449c-4ce5-a37f-d992293ae3fb,Guerra Civil,2024,7.3,Action; Adventure; Thriller,jeremy-clay59,10 April 2024,I was genuinely incredibly impressed by this movie
2b2647e4-a67c-4f93-b18c-a498b761b838,Guerra Civil,2024,7.3,Action; Adventure; Thriller,camwang-43373,11 April 2024,"First time I watch the trailer, I thought it would be a movie that shows a bunch of militaries and politicians trying to come up with some strategies and a lead character just fight for one of two sides, who play a key role in the war and finally that side wins"
3563c756-5002-47f5-8adf-cc02b7abc7f6,Guerra Civil,2024,7.3,Action; Adventure; Thriller,nrshimota,21 April 2024,"Civil War masquerades as a action packed movie that aims to comment on the current state of political division in America, but is afraid to alienate any of its audience so it becomes a strange coming of age story"
27fe5071-2541-4f49-ac1c-fe6c15a3089c,Guerra Civil,2024,7.3,Action; Adventure; Thriller,mgasman,24 May 2024,"I love Garland's previous movies, but this one doesn't get much farther than to say that war is bad"
eeb42147-5b5c-4d5d-bc1f-f318ac991bce,Guerra Civil,2024,7.3,Action; Adventure; Thriller,johno1992,9 April 2024,Think everyone expected a typical war film
d275b71b-8096-4012-97e5-3d3c1e2d7b9e,Guerra Civil,2024,7.3,Action; Adventure; Thriller,Warin_West-El,28 May 2024,"The title is ""Civil War"" but that's the closest you're gonna get to an actual Civil War during this movie"
272ea53a-1ef5-4be1-80ae-9e00612264b2,Guerra Civil,2024,7.3,Action; Adventure; Thriller,Waldorf-1979,13 April 2024,"Note: I'm a big fan of Garland's work, until this one"
627eb95e-6996-4507-9952-4ad5e2c254f4,Guerra Civil,2024,7.3,Action; Adventure; Thriller,rocketwoods,9 April 2024,Then he went out with a bang
299a9bce-3c8e-48b8-b809-fc30716612ab,Guerra Civil,2024,7.3,Action; Adventure; Thriller,masonsaul,9 April 2024,Civil War doesn't really say much but it's got noble intentions as it shows the bravery and desensitisation that journalists have whilst succeeding as an anti-war film that uses the spectacle to disorient and shock rather than thrill
621d14cf-0cb2-49b2-9eed-355f52ef3a85,Guerra Civil,2024,7.3,Action; Adventure; Thriller,Beyondtherain,12 April 2024,"I understood the movie and concept, but it was very underwhelming and quiet"
e7ca33da-1469-42de-b64a-f8e6ac3266d3,Profissão: Perigo,2024,7.0,Action; Comedy; Drama,FeastMode,2 May 2024,The Fall Guy is a movie about making a movie
4c485c65-a911-4236-8f01-9e5d0d980115,Profissão: Perigo,2024,7.0,Action; Comedy; Drama,eziukwuuprightness,14 March 2024,"In an era where blockbusters often demand homework, with their intricate universes and complex lore, ""Barbie"" emerges as a delightful outlier"
7b6f6842-86c6-466c-a173-94fe1a4990b4,Profissão: Perigo,2024,7.0,Action; Comedy; Drama,timothywalton-31924,25 April 2024,The Fall Guy acts best as a glorious ode to the art of stunt work
54036c89-0ed0-430e-ae53-9cd49d106568,Profissão: Perigo,2024,7.0,Action; Comedy; Drama,giorgioglobe,14 May 2024,"Well, what can I say?"
2925eecf-7704-4432-9214-8e77883320f8,Profissão: Perigo,2024,7.0,Action; Comedy; Drama,lunamercury23,28 April 2024,The whole movie is like a lot is going on yet it's all very flat
7884ddd2-163d-4f3a-8cae-acb52c157d2f,Profissão: Perigo,2024,7.0,Action; Comedy; Drama,kobrasec,3 May 2024,Just back from the cinema and can't remove the smile from my face
d58a6d62-5e53-4fa0-ad2a-4a304a7d8a0b,Profissão: Perigo,2024,7.0,Action; Comedy; Drama,iamianiman,19 April 2024,The Fall Guy acts as a homage to all the stuntmen and stuntwomen out there
5abd6f4d-e51d-492b-b87f-c53f9cc7d52f,Profissão: Perigo,2024,7.0,Action; Comedy; Drama,masonsaul,3 May 2024,Whatever problems The Fall Guy has really aren't an issue when the final product is this much fun
5227ea65-67b1-4624-9d71-7e2f2b159e17,Profissão: Perigo,2024,7.0,Action; Comedy; Drama,wheeelertron,4 May 2024,"I'd love to get behind this as a thrilling stunt showcase and worthy campaign for stunt-performance film-awards recognition, all tied together with a witty and self-aware central rom-com performance from two top quality actors with top on-screen chemistry, I did love the trailer, I did find the concept appealing"
17ff3d29-3d03-4b6e-8db4-259df5a8af3b,Profissão: Perigo,2024,7.0,Action; Comedy; Drama,chappy-69103,4 May 2024,"While watching this movie, I found myself smiling nearly the entire time"
474ad017-77a9-4c1b-8ce9-20efeceacb6d,Profissão: Perigo,2024,7.0,Action; Comedy; Drama,barvo_k,7 May 2024,"""The Fall Guy (2024) is a film that owes much of its watchability to the presence of Ryan Gosling, whose performance elevates an otherwise weak storyline"
a896babb-67f4-4e8f-8a61-b953195d63f6,Profissão: Perigo,2024,7.0,Action; Comedy; Drama,jaynzsarah-561-359737,25 May 2024,What a waste
60a0c3e3-9a9c-4406-aa3f-0aebe650e9d2,Profissão: Perigo,2024,7.0,Action; Comedy; Drama,stevewaggawilliams,14 May 2024,This film is absolutely awful
9dfdb9dc-5b3f-4277-830a-58875c6da2f1,Profissão: Perigo,2024,7.0,Action; Comedy; Drama,leonardooliva-16135,12 May 2024,"A movie as we would say around here ""pochoclera"", action comedy (with a lot of action) and that at times is a romantic comedy"
cc29d66c-ab30-4124-9c6c-3ab6ba62a387,Profissão: Perigo,2024,7.0,Action; Comedy; Drama,tmoser1434,4 May 2024,Pros:
5eb43f79-749b-4239-9d61-9f73b257d235,Profissão: Perigo,2024,7.0,Action; Comedy; Drama,Prismark10,21 May 2024,The Fall Guy was a fun cheesy 1980s television show starring Lee Majors
6604f2bc-8481-4a54-a180-386825c08372,Profissão: Perigo,2024,7.0,Action; Comedy; Drama,Geekofriendly,5 May 2024,"Like with ""Top Gun: Maverick"", some witchcraftery was undoubtedly used to shift a thin, generic story into considerably more poignant, refreshing, even warranted territory"
a767a1b6-c77f-464e-96fc-f30e71de5424,Profissão: Perigo,2024,7.0,Action; Comedy; Drama,djbitz9,27 April 2024,"The trend of 3 hour epics, with overly serious narrative, performances, and character development that require 100% attention has dominated cinema for the last decade across every genre"
81a51830-602d-4f24-bb6a-0e497095f6f8,Profissão: Perigo,2024,7.0,Action; Comedy; Drama,Kingslaay,26 May 2024,I had some hopes for The Fall Guy but it felt like they decided on one storyline and changed their mind partway through and pursued another plot
6e3a4da7-92c9-4e5d-b390-b1c5294ca167,Profissão: Perigo,2024,7.0,Action; Comedy; Drama,nina-matzat,13 March 2024,Just got out of the Austin premier at SXSW and the whole theatre went nuts for the movie
c913fea5-aa0e-4e5d-9646-af88512497d2,Profissão: Perigo,2024,7.0,Action; Comedy; Drama,HerbieStretch,24 April 2024,Action and romance with doses of duplicity and deciet combine to make this a broadly appealing and enjoyable romcom
ddf37e70-78e8-4b68-96f9-d7b16ee45328,Profissão: Perigo,2024,7.0,Action; Comedy; Drama,mangelandjela,21 May 2024,Everything about this movie is rediculous and banal
fa25b655-a376-403c-b83e-24d5eab17345,Mad Max: Estrada da Fúria,2015,8.1,Action; Adventure; Sci-Fi,AfricanBro,20 May 2024,"The opening is wild, kicking off with a captivating start"
f1d0cf63-f1ab-4c73-b617-f61bcdfff7a2,Mad Max: Estrada da Fúria,2015,8.1,Action; Adventure; Sci-Fi,planktonrules,10 September 2015,"""Mad Max: Fury Road"" is not the sort of film I enjoy and I after watching it, I am not a huge fan though I deeply respect the filmmakers"
a9c306c4-74f9-4c99-894a-e2e555657d16,Mad Max: Estrada da Fúria,2015,8.1,Action; Adventure; Sci-Fi,ctetrick-04340,11 October 2021,So seeing how this movie had such glowing reviews I thought I'd check it out
d9cea536-cc62-4f3c-98a5-520ce887ea1d,Mad Max: Estrada da Fúria,2015,8.1,Action; Adventure; Sci-Fi,Leofwine_draca,24 February 2016,MAD MAX: FURY ROAD is the finest piece of pure action spectacle that I've watched since THE RAID 2 and JOHN WICK
5cbab913-8502-4d97-91da-28b2030576b1,Mad Max: Estrada da Fúria,2015,8.1,Action; Adventure; Sci-Fi,isaacsuttle,14 May 2015,George Miller returns to live-action filmmaking with one of the greatest action films ever put to screen
3463dea4-323f-4a6a-a6bb-9ed2aafaa60f,Mad Max: Estrada da Fúria,2015,8.1,Action; Adventure; Sci-Fi,caryleavy,24 May 2024,Watching the new film made me realize how special this movie truly is
eef12c38-161b-4e83-bfd7-6acb33151783,Mad Max: Estrada da Fúria,2015,8.1,Action; Adventure; Sci-Fi,confrank,16 May 2015,"Mad Max: Fury Road, starring Tom Hardy and Charlize Theron, is George Miller's attempt to reignite his long dormant Mad Max franchise"
f5d53ef7-2eeb-4f44-8159-0e94a2ce186f,Mad Max: Estrada da Fúria,2015,8.1,Action; Adventure; Sci-Fi,CalRhys,25 May 2015,"The rationale behind the success of 'Fury Road' predominantly lies with director George Miller whose commitment and love for the film series that he's been developing since its first outing in 1979 is evident throughout, and it's pretty obvious that he knows how to craft a damn fine action sequence"
83542472-5daf-4d78-a7fb-49a8b7429570,Mad Max: Estrada da Fúria,2015,8.1,Action; Adventure; Sci-Fi,ivo-cobra8,3 October 2015,When I wrote this review 3 years ago I had no idea how many people hate this movie and they are preferring Mad Max 3 over this film
9d73628a-ccac-417a-80ee-fff75a17b1b6,Mad Max: Estrada da Fúria,2015,8.1,Action; Adventure; Sci-Fi,Imaculata,16 May 2015,I see a lot of negative reviews for this movie popping up
42580c1b-8359-4e38-a695-e6597e99e9ca,Mad Max: Estrada da Fúria,2015,8.1,Action; Adventure; Sci-Fi,motrous,27 April 2021,Don't take my word on this one
c34652ce-1583-4f47-9daf-1ad4da472e51,Mad Max: Estrada da Fúria,2015,8.1,Action; Adventure; Sci-Fi,stephendaxter,13 May 2015,Mad Max Fury Road is George Miller's return to the franchise he started way back in 1979 with Mad Max
fed7eb6f-9265-49f9-b138-2f888bd4e903,Mad Max: Estrada da Fúria,2015,8.1,Action; Adventure; Sci-Fi,alindsayal,29 May 2024,"In preparation for watch Furiosa, I went back and rewatched Mad Max: Fury Road which serves as the film that introduced the character to the big screen and here is my review for it"
f27fb4b6-7022-4b95-849b-1c86f0101ebd,Mad Max: Estrada da Fúria,2015,8.1,Action; Adventure; Sci-Fi,niranjan-32978,29 May 2024,I watched this film for the first time 5 years ago and at that I really liked it
b4a4bd51-1724-4bd5-8201-e2ce15c3da5f,Mad Max: Estrada da Fúria,2015,8.1,Action; Adventure; Sci-Fi,punishable-by-death,14 May 2015,I was left speechless when this finished
41a5a233-c0c9-4579-b79e-1e7c5270ca96,Mad Max: Estrada da Fúria,2015,8.1,Action; Adventure; Sci-Fi,sukhmanjitcheema,11 May 2015,George Miller returns with a bang and takes the helm of this crazy 2hr bonkers extravaganza named Mad Max: Fury Road
6ac4d2a9-5be8-4c67-9238-40b0f2d8291a,Mad Max: Estrada da Fúria,2015,8.1,Action; Adventure; Sci-Fi,Arthur_At_IMDb,25 April 2022,The movie is frantic from start to finish
f8539b01-7eb5-4776-811a-64c2f92750c0,Mad Max: Estrada da Fúria,2015,8.1,Action; Adventure; Sci-Fi,leotfoster,13 May 2015,"Great film, so fast-paced it makes every other film out there look slow and old-fashioned"
e654ce78-457f-4b2c-800a-92f048505411,Mad Max: Estrada da Fúria,2015,8.1,Action; Adventure; Sci-Fi,akdjreview,28 December 2021,The concept of the Mad Max films is incredible
a91af715-c415-4f29-a5d2-3e93b3ececb1,Mad Max: Estrada da Fúria,2015,8.1,Action; Adventure; Sci-Fi,0U,23 February 2020,George Miller elevates action and violence to a true art form in this remake of a classic
69eb8d8c-119a-45e7-9a1c-d939159f08d2,Mad Max: Estrada da Fúria,2015,8.1,Action; Adventure; Sci-Fi,Theo Robertson,6 June 2015,I love post apocalyptic fiction 
1be59e7a-e515-49c7-a312-df8fc0f22f70,Mad Max: Estrada da Fúria,2015,8.1,Action; Adventure; Sci-Fi,Hitchcoc,12 October 2015,I have to say that I tried really hard to like this
50788e97-aaf7-4b43-a128-ed03e704f8a2,O Reino do Planeta dos Macacos,2024,7.2,Action; Adventure; Sci-Fi,druss44121-1,10 May 2024,Really wanted to like this
49fdd097-1ad6-4653-aae5-0d29ae76e7b6,O Reino do Planeta dos Macacos,2024,7.2,Action; Adventure; Sci-Fi,bsabillon,11 May 2024,I'm bummed I didn't love this
300546f2-649d-47ef-8c62-65548be4a821,O Reino do Planeta dos Macacos,2024,7.2,Action; Adventure; Sci-Fi,ZOMB3N,20 May 2024,"With its captivating universe and engaging storyline, ""Kingdom of the Planet of the Apes"" is a success"
b803e5af-6ece-4690-8b6c-95bb84abb7d2,O Reino do Planeta dos Macacos,2024,7.2,Action; Adventure; Sci-Fi,brianmcd1-355-272263,12 May 2024,"Are there any directors left that have watched a Spielberg movie so they can see how to pace an action adventure movie? Very few movies are actually so well written, acted and directed as to warrant a 2:30+ hr run time"
7122c262-9f74-43a3-a168-f48cb0ddde2d,O Reino do Planeta dos Macacos,2024,7.2,Action; Adventure; Sci-Fi,dam-24421,8 May 2024,"I'm a big fan of all the planet of the apes, and they nailed this one"
6fe445ad-7659-45aa-9cf3-a80da6c3cbe0,O Reino do Planeta dos Macacos,2024,7.2,Action; Adventure; Sci-Fi,deason,9 May 2024,This movie is just about a worthy successor to the original set of movies from the 20th century
29c7fa84-0620-405a-9097-239f49e55751,O Reino do Planeta dos Macacos,2024,7.2,Action; Adventure; Sci-Fi,moviemik-3,12 May 2024,I don't know if it's just me because in the past 52 hours I have watched all of the Planet of the Apes movies (excluding Tim Burton's horrible 2001 version) but it seemed to me that this movie was just OK
f8c745ba-f45d-46a8-9004-a4734f9c57c9,O Reino do Planeta dos Macacos,2024,7.2,Action; Adventure; Sci-Fi,bankofmarquis,11 May 2024,"If someone would have said that 2 of the more emotionally rich movie going experiences of the past 6 months (or so) would have been a Godzilla movie and a Planet of the Apes film, I never would have believed you"
5ce6ed27-1bdd-44dc-8b44-07889012e96b,O Reino do Planeta dos Macacos,2024,7.2,Action; Adventure; Sci-Fi,acpwebreg,24 May 2024,Weakest of all the post 2010 POTA movies imo
49f5e006-f03d-4da3-830c-a576e5bea06c,O Reino do Planeta dos Macacos,2024,7.2,Action; Adventure; Sci-Fi,Isak777,8 May 2024,A great follow up to the last trilogy
bb8e240b-2fca-4fb2-8c61-4c08b6f40fe2,O Reino do Planeta dos Macacos,2024,7.2,Action; Adventure; Sci-Fi,AfricanBro,10 May 2024,I was waiting just to hear Proximus scream 'WHAT A WONDERFUL DAY
